{
    "rule_id": "00000000-0000-4000-8000-000000000018",
    "rule_name": "RDP Abuse",
    "description": "Detects RDP Abuse",
    "category": "Lateral Movement",
    "severity": "medium",
    "confidence": 80,
    "base_risk_score": 40,
    "version": "1",
    "mitre_mapping": [
        {
            "tactic": "Lateral Movement",
            "technique_id": "T1021"
        }
    ],
    "conditions": {
        "all": [
            {
                "field": "destination.port",
                "operator": "equals",
                "value": 3389
            }
        ]
    },
    "recommended_actions": [
        {
            "step": 1,
            "action": "Investigate immediately."
        }
    ]
}