{
    "rule_id": "00000000-0000-4000-8000-000000000015",
    "rule_name": "Log Clearing",
    "description": "Detects Log Clearing",
    "category": "Defense Evasion",
    "severity": "high",
    "confidence": 80,
    "base_risk_score": 60,
    "version": "1",
    "mitre_mapping": [
        {
            "tactic": "Defense Evasion",
            "technique_id": "T1070"
        }
    ],
    "conditions": {
        "all": [
            {
                "field": "process.command_line",
                "operator": "contains",
                "value": "wevtutil cl"
            }
        ]
    },
    "recommended_actions": [
        {
            "step": 1,
            "action": "Investigate immediately."
        }
    ]
}