{
    "rule_id": "00000000-0000-4000-8000-000000000004",
    "rule_name": "C2 Beaconing Activity",
    "description": "Detects C2 Beaconing Activity",
    "category": "C2",
    "severity": "high",
    "confidence": 80,
    "base_risk_score": 60,
    "version": "1",
    "mitre_mapping": [
        {
            "tactic": "Command and Control",
            "technique_id": "T1071"
        }
    ],
    "conditions": {
        "all": [
            {
                "field": "event_type",
                "operator": "equals",
                "value": "outbound_connection"
            }
        ]
    },
    "recommended_actions": [
        {
            "step": 1,
            "action": "Investigate immediately."
        }
    ]
}