{
    "rule_id": "00000000-0000-4000-8000-000000000019",
    "rule_name": "Kerberoasting",
    "description": "Detects Kerberoasting",
    "category": "Credential Access",
    "severity": "high",
    "confidence": 80,
    "base_risk_score": 60,
    "version": "1",
    "mitre_mapping": [
        {
            "tactic": "Credential Access",
            "technique_id": "T1558"
        }
    ],
    "conditions": {
        "all": [
            {
                "field": "event_type",
                "operator": "equals",
                "value": "ticket_request"
            }
        ]
    },
    "recommended_actions": [
        {
            "step": 1,
            "action": "Investigate immediately."
        }
    ]
}